{
  "locale": "en",
  "templateId": "phandalin-starter",
  "templateVersion": "1.1.0",
  "translationVersion": "1.0.0",
  "translatedFromLocale": "es",
  "title": "Shadows over Phandalin",
  "subtitle": "Family-friendly starter, prepared sessions and a living town",
  "description": "Frontier sample campaign designed to teach session prep, clear clues, memorable NPCs, town consequences and the player portal.",
  "summary": "Phandalin is a frontier town built over old ruins, unsafe roads and mining promises. Gundren’s disappearance pushes the party toward goblins, bandits, frightened neighbors and a threat still operating from afar.",
  "recommendedFor": "DMs who want to try DMCC with an easy-to-run table campaign, ideal for families or new groups: prepared scenes, clear goals, public material for the player portal and enough secrets to practice revelations without overwhelming the table.",
  "pitch": "A starter campaign for learning DMCC through a comfortable structure: central town, clear quests, memorable NPCs, visible clues and consequences that make players feel Phandalin changing with their decisions.",
  "learningGoals": [
    "Prepare classic adventure sessions with goals, clues and a short checklist.",
    "Use the town as a living hub where each NPC can react to the party’s actions.",
    "Separate public clues, DM secrets and consequences that change Phandalin’s tone.",
    "Publish safe player-facing information without revealing the whole mystery."
  ],
  "includedMaterial": [
    "Five prepared sessions from the opening ambush to the lost mine.",
    "Town NPCs, factions, locations, clues, rumors and table handouts.",
    "Consequence arcs for freeing Phandalin or letting fear grow.",
    "A threat canvas for reading Redbrands, Gundren and the Black Spider at a glance."
  ],
  "quickStart": {
    "title": "How to start Shadows over Phandalin",
    "steps": [
      "Open the fronts canvas and find three axes: missing Gundren, Redbrands in town and the mine as a future promise.",
      "Run session 1 as a simple adventure: ambush, clear clue and a choice to follow tracks or protect supplies.",
      "In session 2, use town NPCs so every player has someone to talk to.",
      "When the party acts against the Redbrands, record how Phandalin’s mood changes as a consequence."
    ]
  },
  "entities": {
    "ent_tpl_phandalin_note": {
      "title": "How to use Phandalin in DMCC",
      "summary": "This example teaches DMCC’s most direct flow: prepare a session, run clear scenes, record clues and let the town react to the party.",
      "content": "This template is designed for family tables: clear goals, recognizable NPCs and simple decisions with visible consequences."
    },
    "ent_tpl_phandalin_town": {
      "title": "Phandalin",
      "subtitle": "Frontier town",
      "summary": "A small settlement trying to prosper while living under external threats and internal intimidation.",
      "status": "unstable",
      "metadata": {
        "region": "Sword Coast frontier",
        "atmosphere": "dust, fresh timber, restrained fear"
      }
    },
    "ent_tpl_phandalin_trail": {
      "title": "Triboar Trail",
      "summary": "The road where the party finds the first signs that Gundren has been attacked.",
      "status": "dangerous"
    },
    "ent_tpl_phandalin_hideout": {
      "title": "Cragmaw Hideout",
      "summary": "A goblin cave that teaches the group Gundren’s disappearance was not random.",
      "status": "explorable"
    },
    "ent_tpl_phandalin_tresendar": {
      "title": "Tresendar Manor",
      "summary": "Ruins hiding the Redbrand base and several moral choices for the group.",
      "status": "active threat",
      "metadata": {
        "type": "urban dungeon"
      }
    },
    "ent_tpl_phandalin_wave_echo": {
      "title": "Wave Echo Cave",
      "summary": "Final destination of Gundren’s search and the heart of the conflict over the Forge of Spells.",
      "status": "hidden"
    },
    "ent_tpl_phandalin_gundren": {
      "title": "Gundren Rockseeker",
      "subtitle": "Dwarven prospector",
      "summary": "He hired the party to escort supplies. His map is the piece everyone wants.",
      "status": "missing",
      "metadata": {
        "role": "opening patron",
        "desire": "recover the family mine"
      }
    },
    "ent_tpl_phandalin_sildar": {
      "title": "Sildar Hallwinter",
      "subtitle": "Veteran and potential ally",
      "summary": "He can explain the context and give the group a reason to protect Phandalin.",
      "status": "ally",
      "metadata": {
        "role": "campaign mentor"
      }
    },
    "ent_tpl_phandalin_redbrands": {
      "title": "Redbrands",
      "subtitle": "Red-cloaked thugs",
      "summary": "They control the town’s fear through low-intensity violence and public threats.",
      "status": "active",
      "metadata": {
        "agenda": "maintain social control"
      }
    },
    "ent_tpl_phandalin_iarno": {
      "title": "Iarno Albrek / Glasstaff",
      "subtitle": "Missing wizard with a double identity",
      "summary": "Sildar’s clue points to a lost ally, but the truth connects him to the Redbrands.",
      "status": "hidden",
      "metadata": {
        "publicMask": "missing wizard",
        "secretIdentity": "Glasstaff"
      }
    },
    "ent_tpl_phandalin_nezznar": {
      "title": "Nezznar, the Black Spider",
      "summary": "He wants to reach Wave Echo Cave first and control the Forge.",
      "status": "distant threat",
      "metadata": {
        "role": "final antagonist"
      }
    },
    "ent_tpl_phandalin_quest_gundren": {
      "title": "Find Gundren",
      "summary": "The main thread: follow the trail from the ambush to Cragmaw and eventually the mine.",
      "metadata": {
        "objective": "rescue Gundren and recover the map"
      }
    },
    "ent_tpl_phandalin_clue_dead_horses": {
      "title": "Dead horses on the road",
      "summary": "The first physical clue: the attack was prepared and Gundren was ahead of the party.",
      "status": "ready",
      "metadata": {
        "delivery": "opening scene"
      }
    },
    "ent_tpl_phandalin_secret_iarno": {
      "title": "Iarno is Glasstaff",
      "summary": "Sildar’s missing ally leads or manipulates the Redbrands from Tresendar.",
      "metadata": {
        "revealImpact": "changes trust in adult allies"
      }
    },
    "ent_tpl_phandalin_consequence_town": {
      "title": "Phandalin finds its voice again",
      "summary": "If the Redbrands fall, the town starts acting, speaking and asking for help in visible ways.",
      "metadata": {
        "trigger": "defeat or expose the Redbrands"
      }
    },
    "ent_tpl_phandalin_inn": {
      "title": "Stonehill Inn",
      "subtitle": "Safe place for conversations",
      "summary": "Social hub where the party can hear rumors, rest and measure the town’s fear.",
      "content": "Use it to introduce NPCs without forcing scenes: someone is always listening, exaggerating or asking for help."
    },
    "ent_tpl_phandalin_shrine": {
      "title": "Shrine of Luck",
      "subtitle": "Small refuge with useful information",
      "summary": "A calm place where a kind conversation can provide clues about disappearances and night movements.",
      "content": "Good place for players seeking help without going through violence."
    },
    "ent_tpl_phandalin_toblen": {
      "title": "Toblen Stonehill",
      "subtitle": "Innkeeper who knows more than he wants to admit",
      "summary": "He hears everyone’s rumors, but fears the Redbrands will punish his family.",
      "content": "Toblen helps if the group shows they are not here just to provoke a fight."
    },
    "ent_tpl_phandalin_linene": {
      "title": "Linene Graywind",
      "subtitle": "Pragmatic merchant",
      "summary": "She wants safe roads and does not trust improvised heroes until she sees results.",
      "content": "She can offer gear, information about lost supplies or a dry warning about the Redbrands."
    },
    "ent_tpl_phandalin_halia": {
      "title": "Halia Thornton",
      "subtitle": "Ambitious, useful and dangerous",
      "summary": "She may help against the Redbrands if that increases her influence over Phandalin.",
      "content": "Halia gives practical information, but always tries to keep a political advantage."
    },
    "ent_tpl_phandalin_qelline": {
      "title": "Qelline Alderleaf",
      "subtitle": "Kind neighbor with discreet contacts",
      "summary": "She knows less-watched roads and can point the group toward outside help.",
      "content": "Ideal for family tables: offers warmth, food and a nonviolent way to gain direction."
    },
    "ent_tpl_phandalin_quest_break_fear": {
      "title": "Break the Redbrands’ fear",
      "subtitle": "Urban arc of Phandalin",
      "summary": "The group must move from hearing complaints to giving the town a concrete reason to act.",
      "content": "It is not solved only by defeating enemies: the town changes when it sees protection, proof or leadership."
    },
    "ent_tpl_phandalin_clue_blackseal": {
      "title": "Note with a black seal",
      "subtitle": "Clue toward a distant hand",
      "summary": "A short note orders Gundren kept alive until the full map is found.",
      "content": "It does not reveal everything about Nezznar, but introduces that the Redbrands are not the end of the chain.",
      "metadata": {
        "content": "The order comes from someone signing with a black spider, not from Glasstaff."
      }
    },
    "ent_tpl_phandalin_clue_redclay": {
      "title": "Boots with red clay",
      "subtitle": "Physical clue in town",
      "summary": "Several bandit boots carry clay from the old path toward Tresendar.",
      "content": "Lets the group find the base without relying on interrogations.",
      "metadata": {
        "content": "The clay matches the abandoned path below Tresendar Manor."
      }
    },